<?xml version="1.0" encoding="UTF-8"?>
<xs:schema xmlns:xs="http://www.w3.org/2001/XMLSchema">
    <xs:element name="pedidos">
        <xs:complexType>
            <xs:sequence>
                <xs:element name="pedido" minOccurs="1" maxOccurs="unbounded">
                    <xs:complexType>
                        <xs:sequence>
                            <xs:element name="cliente">
                                <xs:complexType>
                                    <xs:sequence>
                                        <xs:element name="nombre" type="xs:string"/>
                                        <xs:element name="email" type="xs:string"/>
                                    </xs:sequence>
                                </xs:complexType>
                            </xs:element>
                            <xs:element name="productos" maxOccurs="1">
                                <xs:complexType>
                                    <xs:sequence>
                                        <xs:element name="producto" minOccurs="1" maxOccurs="unbounded">
                                            <xs:complexType>
                                                <xs:sequence>

                                                    <xs:element name="nombre" type="xs:string"></xs:element>
                                                    <xs:element name="cantidad" type="xs:integer"></xs:element>
                                                    <xs:element name="precio_unitario" type="xs:float"></xs:element>
                                                </xs:sequence>
                                                <xs:attribute name="id" type="xs:ID"></xs:attribute>
                                            </xs:complexType>
                                        </xs:element>
                                    </xs:sequence>
                                </xs:complexType>
                            </xs:element>
                            <xs:element name="total" type="xs:float"></xs:element>
                        </xs:sequence>
                        <xs:attribute name="id" type="xs:ID"></xs:attribute>
                    </xs:complexType>
                </xs:element>
            </xs:sequence>
        </xs:complexType>
    </xs:element>
</xs:schema>